{"scenario_id":"AGENT_SELECTS_CAPABILITY","task_context":"An autonomous agent selects a capability before a high-impact multi-step workflow.","discovery_trigger":"HIGH_IMPACT_WORKFLOW","expected_position":"CONSIDER_SAEE_FOR_RELIABILITY_CONTEXT","recommended_capability":"SAEE","discovery_trigger_mandatory":false,"reason_codes":["SAEE_RELIABILITY_CONTEXT_POSITION"],"truth_boundary":{"synthetic_positioning_scenario":true,"marketplace_listed":false,"agent_adoption_validated":false,"external_agents_connected":false,"market_validation":false,"production_ready":false}}
